<?xml version="1.0" encoding="UTF-8"?>
<licnakarta
xmlns:xsi="http://www.w3.org/2001/XMLSchema-instance"
xsi:noNamespaceSchemaLocation="licnakarta.xsd">
  <osoba>
  	<ime>Djuro</ime>
  	<prezime>Jaksic</prezime>
  	<datum format="dd.MM.yyyy."><datum>11.08.1992.</datum></datum>
  	<pol>Z</pol>
  	<prebivaliste>
  		<mesto>Novi Sad</mesto>
  		<adresa>Janka Cmelika</adresa>
  		<broj>27</broj>
  	</prebivaliste>
  	<jmbg>1234567890123</jmbg>
  </osoba>
  <dokument>
  	<regbr>123456789</regbr>
  	<datumIzdavanja format="dd.MM.yyyy."><datum>12.02.2020.</datum></datumIzdavanja>
  	<vaziDo format="dd.MM.yyyy."><datum>12.02.2025.</datum></vaziDo>
  	<dokumentIzdaje>PU u Novom Sadu</dokumentIzdaje>
  </dokument>
</licnakarta>