<?xml version="1.0" encoding="UTF-8"?>
<licnakarta
xmlns:xsi="http://www.w3.org/2001/XMLSchema-instance"
xsi:noNamespaceSchemaLocation="licnakarta.xsd">
  <osoba>
  	<ime>Jelena</ime>
  	<prezime>Karleusa</prezime>
  	<datum format="dd.MM.yyyy."><datum>17.08.1978.</datum></datum>
  	<pol>M</pol>
  	<prebivaliste>
  		<mesto>Vranje</mesto>
  		<adresa>Bezimena</adresa>
  		<broj>1</broj>
  	</prebivaliste>
  	<jmbg>1234567890123</jmbg>
  </osoba>
  <dokument>
  	<regbr>123456789</regbr>
  	<datumIzdavanja format="dd.MM.yyyy."><datum>17.08.2069.</datum></datumIzdavanja>
  	<vaziDo format="dd.MM.yyyy."><datum>17.08.2074.</datum></vaziDo>
  	<dokumentIzdaje>PU u Novom Sadu</dokumentIzdaje>
  </dokument>
</licnakarta>