<?xml version="1.0" encoding="UTF-8"?>
<licnakarta
xmlns:xsi="http://www.w3.org/2001/XMLSchema-instance"
xsi:noNamespaceSchemaLocation="licnakarta.xsd">
  <osoba>
  	<ime>Marko</ime>
  	<prezime>98</prezime>
  	<datum format="dd.MM.yyyy."><datum>10.07.1991.</datum></datum>
  	<pol>M</pol>
  	<prebivaliste>
  		<mesto>Novi Sad</mesto>
  		<adresa>Janka Cmelika</adresa>
  		<broj>26</broj>
  	</prebivaliste>
  	<jmbg>1234567890123</jmbg>
  </osoba>
  <dokument>
  	<regbr>123456789</regbr>
  	<datumIzdavanja format="dd.MM.yyyy."><datum>11.01.2020.</datum></datumIzdavanja>
  	<vaziDo format="dd.MM.yyyy."><datum>11.01.2025.</datum></vaziDo>
  	<dokumentIzdaje>PU u Novom Sadu</dokumentIzdaje>
  </dokument>



  <osoba1>
  	<ime>Djuro</ime>
  	<prezime>Jaksic</prezime>
  	<datum format="dd.MM.yyyy."><datum>11.08.1992.</datum></datum>
  	<pol>Z</pol>
  	<prebivaliste>
  		<mesto>Novi Sad</mesto>
  		<adresa>Janka Cmelika</adresa>
  		<broj>27</broj>
  	</prebivaliste>
  	<jmbg>1234567890123</jmbg>
  </osoba1>
  <dokument1>
  	<regbr>123456789</regbr>
  	<datumIzdavanja format="dd.MM.yyyy."><datum>12.02.2020.</datum></datumIzdavanja>
  	<vaziDo format="dd.MM.yyyy."><datum>12.02.2025.</datum></vaziDo>
  	<dokumentIzdaje>PU u Novom Sadu</dokumentIzdaje>
  </dokument1>


  <osoba2>
  	<ime>Jelena</ime>
  	<prezime>Karleusa</prezime>
  	<datum format="dd.MM.yyyy."><datum>17.08.1978.</datum></datum>
  	<pol>M</pol>
  	<prebivaliste>
  		<mesto>Vranje</mesto>
  		<adresa>Bezimena</adresa>
  		<broj>1</broj>
  	</prebivaliste>
  	<jmbg>1234567890123</jmbg>
  </osoba2>
  <dokument2>
  	<regbr>123456789</regbr>
  	<datumIzdavanja format="dd.MM.yyyy."><datum>17.08.2069.</datum></datumIzdavanja>
  	<vaziDo format="dd.MM.yyyy."><datum>17.08.2074.</datum></vaziDo>
  	<dokumentIzdaje>PU u Novom Sadu</dokumentIzdaje>
  </dokument2>
</licnakarta>